{
  "id": "context7",
  "marketplaceId": "markgravity/context7",
  "kind": "mcp",
  "name": "Context7",
  "description": "Fetches up-to-date documentation for any library directly into your Claude context.",
  "author": "markgravity",
  "tags": [
    "docs",
    "mcp",
    "research",
    "libraries"
  ],
  "iconSF": "books.vertical",
  "featured": false,
  "version": "1.0.0",
  "mcpTransport": "stdio",
  "mcpInstallCommand": "npx",
  "mcpInstallArgs": [
    "-y",
    "@upstash/context7-mcp@latest"
  ]
}
