{
  "id": "create-add-claudy-plugin-pr",
  "marketplaceId": "markgravity",
  "kind": "command",
  "name": "Create Add Claudy Plugin PR",
  "description": "Creates a claudy-registry PR to add a new plugin from a GitHub URL, local .md file, or local directory.",
  "author": "markgravity",
  "tags": ["git", "github", "plugin", "marketplace", "pr", "claudy"],
  "iconSF": "arrow.triangle.branch",
  "featured": false,
  "version": "1.0.0",
  "githubRepo": "markgravity/claudy-registry",
  "githubPath": "plugins/markgravity/create-add-claudy-plugin-pr"
}
